id,pali_text,ref_vietnamese,source,trans_Pali_Llama-3.3-70b,judge_Pali_Llama-3.3-70b,trans_Pali_GPT-OSS-120b,judge_Pali_GPT-OSS-120b,trans_Pali_Kimi-k2,judge_Pali_Kimi-k2,trans_Pali_Qwen3-32b,judge_Pali_Qwen3-32b
12,"Sārañca sārato ñatvā, asārañca asārato; Te sāraṃ adhigacchanti, sammāsaṅkappagocarā.","Chân thật, biết chân thật, Không chân, biết không chân. Chúng đạt được chân thật, Do chánh tư chánh hạnh.",Dhammapada 12 (Thích Minh Châu),"Biết rõ những điều có giá trị từ nơi có giá trị, và biết rõ những điều không có giá trị từ nơi không có giá trị. Những người như vậy đạt được điều có giá trị, trong phạm vi của tư duy chánh trực.","{
  ""accuracy"": 4,
   ""fluency"": 5,
   ""explanation"": ""The translation generally preserves the meaning of the Pali text, with minor imperfections in conveying the nuances of 'sāra' and 'asāra', but is expressed in very natural and fluent Vietnamese.""
}","Biết được bản chất và không bản chất; họ đạt được bản chất, những người hành đạo với ý định chính xác.",{},"Biết rõ cái gì là chân thật thì là chân thật, cái gì không chân thật thì không chân thật; Những người sống đúng với tư duy chánh niệm sẽ đạt được điều chân thật.",{},"<think>
Okay, let's tackle this Pali to Vietnamese translation. First, I need to understand the original text. The Pali verse is about understanding what is essential and what is not, leading to attaining the essence through right intention.

Starting with ""Sārañca sārato ñatvā,"" ""Sāra"" means essence or the core, ""ñatvā"" is knowing or understanding. So, ""Knowing the essence and the non-essence."" Next line: ""asārañca asārato;"" which is similar but refers to the non-essence. Then, ""Te sāraṃ adhigacchanti,"" ""They attain the essence."" Lastly, ""sammāsaṅkappagocarā."" ""Sammāsaṅkappa"" is right intention, ""gocarā"" is those who go or follow. So, ""Those who follow right intention.""

Now, translating into Vietnamese. ""Sāra"" is ""bản chất,"" ""ñatvā"" is ""hiểu rõ."" So the first line becomes ""Hiểu rõ bản chất và phi bản chất,"" then ""Người theo chánh tư duy đạt đến bản chất."" Wait, the structure in Vietnamese should mirror the original. Let me check again. The first part is knowing both essence and non-essence, then those who follow right intention attain the essence. Maybe split into two lines for clarity. 

Double-checking the terms: ""sammāsaṅkappa"" is ""chánh tư duy"" in Vietnamese. ""Adhigacchanti"" is ""đạt được"" or ""đạt đến."" So the translation should be:

Hiểu rõ bản chất và phi bản chất,  
Người theo chánh tư duy đạt đến bản chất.

But the original has ""sāraṃ adhigacchanti,"" which is ""attain the essence."" So maybe ""Người theo chánh tư duy đạt được bản chất."" Hmm, but the original uses ""adhigacchanti"" which is present tense, so ""đạt đến"" might be better. Also, the structure in the original has two lines, each with two parts. Let me ensure the Vietnamese lines are balanced. 

Final check: The first line is about knowing essence and non-essence, the second about attaining essence through right intention. The translation should capture that flow. Yes, the lines are parallel and the terms are correctly translated. I think this should be accurate.
</think>

Hiểu rõ bản chất và phi bản chất,  
Người theo chánh tư duy đạt đến bản chất.",{}
13,"Yathā agāraṃ ducchannaṃ, vuṭṭhī samativijjhati; Evaṃ abhāvitaṃ cittaṃ, rāgo samativijjhati.","Như nhà lợp không kín, Mưa liền xâm nhập vào. Cũng vậy tâm không tu, Tham dục liền xâm nhập.",Dhammapada 13 (Thích Minh Châu),"Giống như một ngôi nhà bẩn thỉu, gió thổi qua mọi nơi; cũng vậy, một tâm chưa được tu tập, tham dục thâm nhập khắp nơi.","{
  ""accuracy"": 4,
   ""fluency"": 5,
   ""explanation"": ""The translation generally preserves the meaning but uses 'gió thổi qua mọi nơi' (wind blows everywhere) instead of 'mưa liền xâm nhập vào' (rain immediately penetrates), which is a minor deviation from the reference translation.""
}","Như một ngôi nhà hư hỏng nặng, mái nhà sụp đổ hoàn toàn; như vậy, khi tâm không còn, dục vọng (rāga) cũng sụp đổ hoàn toàn.",{},"Như ngôi nhà mái dột, mưa xuyên thấm vào; cũng vậy tâm không tu tập, tham dục xuyên thấm vào.",{},"<think>
Okay, let's tackle this Pali translation. First, I need to understand the original text. The sentence is in Pali, and I need to translate it into Vietnamese. The user wants only the translation, no extra commentary, so I have to be precise.

The text is: Yathā agāraṃ ducchannaṃ, vuṭṭhī samativijjhati; Evaṃ abhāvitaṃ cittaṃ, rāgo samativijjhati.

Breaking it down, ""Yathā"" means ""Just as"" or ""Like"". ""Agāraṃ"" is ""a house"". ""Ducchannaṃ"" is ""well-hidden"" or ""securely closed"". ""Vuṭṭhī"" might be ""a thief"" or ""robber"". ""Samativijjhati"" is a verb, perhaps ""arises"" or ""appears"". 

The second part: ""Evaṃ"" is ""so too"" or ""in the same way"". ""Abhāvitaṃ cittaṃ"" translates to ""an unguarded mind"". ""Rāgo"" is ""desire"" or ""lust"". ""Samativijjhati"" again, so ""arises"" or ""appears"".

Putting the first part together: ""Just as a house that is well-hidden, a thief arises..."" Wait, maybe ""a thief appears"" or ""a thief arises"". The structure is a simile: Just as when a house is well-hidden, a thief arises; in the same way, when the mind is unguarded, desire arises.

Now translating into Vietnamese. The structure is a comparison between a house and the mind. The key is to maintain the parallelism.

""Giống như một ngôi nhà được che giấu kín đáo, tên trộm xuất hiện; Cũng vậy, khi tâm không được gìn giữ, dục vọng nảy sinh.""

Let me check each term again. ""Agāraṃ"" is house. ""Ducchannaṃ"" is well-hidden or securely closed. ""Vuṭṭhī"" is thief. ""Samativijjhati"" is arises. ""Abhāvitaṃ cittaṃ"" is unguarded mind. ""Rāgo"" is desire. 

Yes, that seems right. The translation should reflect the simile accurately. Make sure the verbs are correctly placed. ""Xuất hiện"" for ""arises"" for the thief, and ""nảy sinh"" for desire. The structure in Vietnamese should mirror the Pali's structure. 

I think that's correct. Let me double-check any possible errors. Maybe ""che giấu kín đáo"" for ""well-hidden"". ""Tâm không được gìn giữ"" for ""unguarded mind"". Yes, that's accurate. The translation is ready.
</think>

Giống như một ngôi nhà được che giấu kín đáo, tên trộm xuất hiện; Cũng vậy, khi tâm không được gìn giữ, dục vọng nảy sinh.",{}
14,"Yathā agāraṃ suchannaṃ, vuṭṭhī na samativijjhati; Evaṃ subhāvitaṃ cittaṃ, rāgo na samativijjhati.","Như nhà khéo lợp kín, Mưa không xâm nhập vào. Cũng vậy tâm khéo tu, Tham dục không xâm nhập.",Dhammapada 14 (Thích Minh Châu),"Giống như một ngôi nhà được lau chùi sạch sẽ, gió không thổi tung lên; Cũng vậy, tâm được tu dưỡng tốt, tham không xâm chiếm.","{
  ""accuracy"": 3,
   ""fluency"": 4,
   ""explanation"": ""The translation generally preserves the meaning but uses 'gió' (wind) instead of 'mưa' (rain) and 'tham' (greed) instead of 'tham dục' (craving), and 'xâm chiếm' (invade) instead of 'xâm nhập' (penetrate), which are more accurate terms used in the reference translation.""
}","Như một ngôi nhà được xây dựng vững chắc, không bị sụp đổ; như vậy, tâm trí được rèn luyện tốt, không bị tham ái chiếm đoạt.",{},"Như ngôi nhà được lợp kín, mưa không thể xuyên thấu; cũng vậy tâm được tu tập tốt, tham không thể xuyên thấu.",{},"<think>
Okay, let's tackle this Pali to Vietnamese translation. First, I need to understand the original text. The Pali verse is:

""Yathā agāraṃ suchannaṃ, vuṭṭhī na samativijjhati; Evaṃ subhāvitaṃ cittaṃ, rāgo na samativijjhati.""

Breaking it down, ""Yathā"" means ""Just as"" or ""Like."" ""Agāraṃ"" is ""a house,"" ""suchannaṃ"" is ""covered"" or ""protected."" The next part, ""vuṭṭhī na samativijjhati,"" ""vuṭṭhī"" is ""thief,"" ""na"" is ""not,"" ""samativijjhati"" is a compound verb meaning ""can enter"" or ""can intrude."" So the first line translates to ""Just as a covered house, a thief cannot enter.""

The second line starts with ""Evaṃ,"" which is ""So"" or ""In the same way."" ""Subhāvitaṃ cittaṃ"" is ""a well-guarded mind,"" ""rāgo"" is ""desire"" or ""lust,"" and ""na samativijjhati"" again means ""cannot enter."" So the second line is ""So a well-guarded mind, desire cannot enter.""

Now, translating this into Vietnamese. The key is to maintain the parallel structure and the metaphor. The first part is about a house being protected, so in Vietnamese, ""Một ngôi nhà được che đậy kín"" for ""a covered house."" Then ""trộm không thể xâm nhập"" for ""thief cannot intrude.""

For the second part, ""Tương tự, tâm được tu tập tốt"" for ""In the same way, a well-guarded mind,"" and ""tham dục không thể xâm nhập"" for ""desire cannot intrude.""

I need to check if the terms are accurate. ""Subhāvitaṃ"" is ""well-guarded"" or ""well-cultivated,"" so ""tu tập tốt"" is appropriate. ""Rāgo"" is desire, so ""tham dục"" is correct. Also, making sure the sentence structure in Vietnamese flows naturally, using ""Tương tự"" to mirror ""Evaṃ.""

Double-checking the verbs: ""samativijjhati"" is ""can enter,"" so ""không thể xâm nhập"" is ""cannot intrude/enter."" That seems right. The metaphor is comparing a protected house to a protected mind, so the translation should reflect that analogy clearly.

I think that's it. The translation should be accurate and maintain the original's meaning and structure.
</think>

Chỉ như ngôi nhà được che đậy kín, trộm không thể xâm nhập; Tương tự tâm được tu tập tốt, tham dục không thể xâm nhập.",{}
15,"Idha socati pecca socati, pāpakārī ubhayattha socati; So socati so vihaññati, disvā kammakiliṭṭhamattano.","Nay sầu, đời sau sầu, Kẻ ác, hai đời sầu. Nó sầu, nó ưu não, Thấy nghiệp uế mình làm.",Dhammapada 15 (Thích Minh Châu),"Ở đây, người có tội sẽ đau khổ, và sau khi chết cũng sẽ đau khổ, kẻ làm ác sẽ đau khổ ở cả hai nơi; Người ấy sẽ đau khổ, người ấy sẽ sầu não, khi thấy nghiệp dơ bẩn của mình.","{
  ""accuracy"": 4,
   ""fluency"": 4,
   ""explanation"": ""The translation generally preserves the original meaning but has minor imperfections and slight awkwardness in phrasing, such as using 'người có tội' instead of 'kẻ ác' and 'nghiệp dơ bẩn' which could be more naturally translated.""
}","Ở đây người này than thở, sau này người này cũng than thở; kẻ làm ác ở cả hai nơi đều than thở. Người ấy than thở, tự hủy diệt mình khi thấy công việc của mình ô uế.",{},"Ở đây người ấy khóc, sau khi chết cũng khóc; kẻ làm điều ác khóc ở cả hai nơi. Người ấy khóc, người ấy đau khổ, khi thấy nghiệp ô uế của chính mình.",{},"<think>
Okay, let's tackle this Pali to Vietnamese translation. First, I need to understand the original text. The Pali sentence is:

""Idha socati pecca socati, pāpakārī ubhayattha socati; So socati so vihaññati, disvā kammakiliṭṭhamattano.""

Breaking it down, ""socati"" means to grieve or lament. ""Idha"" is ""here,"" ""pecca"" is ""after,"" ""pāpakārī"" might be a compound word. Let's see, ""pāpa"" is evil or bad, ""kārī"" could be doer or maker. So ""pāpakārī"" is one who does evil. ""Ubhayattha"" is both ways or both sides. ""Vihaññati"" is to be destroyed or perish. ""Disvā"" is having seen, ""kammakiliṭṭhamattano"" – ""kamma"" is action or deed, ""kiliṭṭha"" is result or fruit, ""mattano"" is his own. So putting it together:

Here he grieves, after he grieves, the evildoer grieves on both sides; He who grieves is destroyed, having seen the result of his own deeds.

Now translating into Vietnamese. Let's make sure the terms are accurate. ""Pāpakārī"" is ""người làm ác"" (evil-doer). ""Ubhayattha socati"" would be ""buồn đau cả hai phía"" or ""buồn đau ở cả hai phương diện."" ""Vihaññati"" is ""bị tiêu diệt"" or ""phá vỡ."" ""Disvā kammakiliṭṭhamattano"" is ""đã thấy quả báo của chính mình.""

So the translation would be:

Ở đây anh ta buồn đau, sau này anh ta cũng buồn đau, người làm ác buồn đau ở cả hai phía; Ai buồn đau sẽ bị tiêu diệt, đã thấy quả báo của chính mình.

Wait, maybe ""sau này"" for ""pecca socati"" is a bit off. ""Pecca"" is ""after,"" so maybe ""sau đó"" or ""sau này anh ta cũng buồn đau."" Hmm. Also, ""ubhayattha"" is both sides or both ways, so ""cả hai phía"" is okay. Let me check again. The first part: ""Idha socati pecca socati"" – here he grieves, after he grieves. So maybe ""Ở đây anh ta buồn đau, sau đó anh ta cũng buồn đau."" Then ""pāpakārī ubhayattha socati"" – the evildoer grieves on both sides. Then the second part: ""So socati so vihaññati"" – he who grieves is destroyed. ""Disvā kammakiliṭṭhamattano"" – having seen the result of his own deeds.

So the final translation should be accurate and natural in Vietnamese. Let me adjust slightly for flow:

Ở đây anh ta buồn đau, sau đó anh ta cũng buồn đau, người làm ác buồn đau ở cả hai phía; Ai buồn đau sẽ bị tiêu diệt, đã thấy quả báo của chính mình.

Yes, that seems right. Make sure the terms are consistent and the sentence structure is correct in Vietnamese.
</think>

Ở đây anh ta buồn đau, sau đó anh ta cũng buồn đau, người làm ác buồn đau ở cả hai phía; Ai buồn đau sẽ bị tiêu diệt, đã thấy quả báo của chính mình.",{}
16,"Idha modati pecca modati, katapuñño ubhayattha modati; So modati so pamodati, disvā kammavisuddhimattano.","Nay vui, đời sau vui, Người thiện, hai đời vui. Nó vui, nó an vui, Thấy nghiệp tịnh mình làm.",Dhammapada 16 (Thích Minh Châu),"Ở đây, kẻ ngu si bị đánh lừa hai lần, bị lừa ở cả hai thế giới vì hành động ác; Kẻ ấy bị lừa, bị vui mừng, khi nhìn thấy sự trong sạch của hành động của mình.","{
  ""accuracy"": 2,
   ""fluency"": 4,
   ""explanation"": ""The translation significantly deviates from the original Pali text's meaning, using 'kẻ ngu si' (foolish person) instead of conveying the idea of joy or delight in both this life and the next due to good deeds, and misinterpreting 'modati' as being deceived rather than experiencing joy.""
}","Ở đây người ấy vui mừng, sau này cũng vui mừng, công đức đã làm mang lại niềm vui ở cả hai nơi; người ấy vui mừng, người ấy hân hoan, khi thấy sự thanh tịnh của nghiệp mình.",{},"Ở đây người ấy vui, sau khi chết cũng vui; người có phước vui ở cả hai nơi. Người ấy vui và hoan hỷ, thấy rõ nghiệp thanh tịnh của mình.",{},"<think>
Okay, let's tackle this Pali to Vietnamese translation. First, I need to understand the original text. The Pali sentence is: ""Idha modati pecca modati, katapuñño ubhayattha modati; So modati so pamodati, disvā kammavisuddhimattano.""

Breaking it down, ""Idha modati pecca modati"" – ""Idha"" means ""here"" or ""in this way,"" ""modati"" is a verb meaning ""rejoices"" or ""is glad."" ""Pecca"" could be a form of ""pacce"" meaning ""after"" or ""subsequently."" So maybe ""Here he rejoices, later he rejoices.""

Next part: ""katapuñño ubhayattha modati."" ""Katapuñño"" is a compound word. ""Kata"" might be past participle of ""kata"" (done), ""puñña"" is ""merit"" or ""good deed."" So ""katapuñño"" could be ""one who has done merit."" ""Ubhayattha"" means ""both ways"" or ""in both respects."" So ""one who has done merit rejoices in both ways.""

Then: ""So modati so pamodati,"" ""So"" is ""he,"" ""modati"" again ""rejoices,"" ""pamodati"" is another form of rejoicing, maybe ""exults"" or ""is overjoyed."" So ""He rejoices, he exults.""

Last part: ""disvā kammavisuddhimattano."" ""Disvā"" is ""seeing"" or ""having seen,"" ""kammavisuddhi"" is ""purification of action"" or ""cleansing of deeds,"" ""mattano"" might be a form of ""matta"" meaning ""contentment"" or ""satisfaction."" So ""seeing the purification of his deeds, he is content.""

Putting it all together in Vietnamese, I need to make sure the translation flows naturally. Let me check each part again for accuracy. ""Idha modati pecca modati"" could be ""Ở đây, người ấy vui, sau này người ấy vui."" Then ""katapuñño ubhayattha modati"" – ""Người đã tạo phước vui trong cả hai."" Next, ""So modati so pamodati"" – ""Người ấy vui, người ấy hân hoan."" Finally, ""disvā kammavisuddhimattano"" – ""Thấy sự thanh tịnh của nghiệp, người ấy mãn nguyện.""

Wait, ""mattano"" might be ""matta"" as in contentment, so ""mãn nguyện"" is good. Let me confirm the terms. ""Kammavisuddhi"" is purification of action, so ""thanh tịnh của nghiệp"" makes sense. ""Pamodati"" is stronger than ""modati,"" so ""hân hoan"" is appropriate. 

I think that's accurate. Let me read the whole translation again to ensure it's smooth and conveys the original meaning correctly.
</think>

Ở đây người ấy vui, sau này người ấy vui; người đã tạo phước vui trong cả hai. Người ấy vui, người ấy hân hoan, thấy sự thanh tịnh của nghiệp, người ấy mãn nguyện.",{}
17,"Idha tappati pecca tappati, pāpakārī ubhayattha tappati; Pāpaṃ me katanti tappati, bhiyyo tappati duggatiṃ gato.","Nay than, đời sau than, Kẻ ác, hai đời than. Nó than: Ta làm ác, Ðọa cõi dữ, than hơn.",Dhammapada 17 (Thích Minh Châu),"Ở đây, người làm ác bị đốt, và ở thế giới sau khi chết, người đó cũng bị đốt; Người nghĩ ""Tôi đã làm ác"" bị đốt, và bị đốt nhiều hơn khi đã rơi vào cõi khổ.","{
  ""accuracy"": 5,
   ""fluency"": 4,
   ""explanation"": ""The translation accurately preserves the meaning of the Pali text, but the phrasing could be more natural and fluent in Vietnamese.""
}","Ở đây ngã, ở kia ngã, kẻ làm ác ngã ở cả hai nơi; Kẻ làm ác với ta ngã, người ấy ngã, đã rơi vào nghiệp xấu.",{},"Ở đây, kẻ làm ác khổ trong hiện tại và cũng khổ sau khi chết; kẻ làm ác khổ ở cả hai nơi. Khi nghĩ “Ta đã làm điều ác”, y khổ; khi đọa vào ác thú, y càng khổ hơn.",{},"<think>
Okay, let's tackle this Pali to Vietnamese translation. First, I need to understand the original text. The sentence structure in Pali can be a bit tricky, especially with the use of different tenses and particles.

Starting with ""Idha tappati pecca tappati,"" I know ""idha"" means ""here"" and ""tappati"" is a verb, maybe something like ""cries"" or ""lament."" ""Pecca"" could be a preposition meaning ""after"" or ""later."" So maybe ""Here he cries, later he cries.""

Next, ""pāpakārī ubhayattha tappati;"" ""Pāpaka"" might be related to ""pāpa"" which means ""evil"" or ""sin,"" and ""kārī"" could be a suffix indicating a doer. So ""pāpakārī"" is ""the doer of evil."" ""Ubhayattha"" might mean ""in both ways"" or ""on both sides."" So ""The doer of evil cries in both ways.""

Then, ""Pāpaṃ me katanti tappati,"" ""Pāpaṃ"" is ""evil,"" ""me"" is ""my,"" ""katanti"" is ""does"" or ""commits,"" so ""Crying, he commits evil."" But the structure here is a bit different. Maybe ""Crying, he says, 'I have done evil.'""

""Bhiyyo tappati duggatiṃ gato."" ""Bhiyyo"" is ""more,"" ""duggatiṃ"" is ""bad destination"" or ""woeful state,"" ""gato"" is ""gone."" So ""He cries more, having gone to a woeful state.""

Putting it all together, the translation should flow naturally in Vietnamese. Let me check each part again to ensure accuracy. The key is to maintain the meaning while making it sound like natural Vietnamese. Also, the use of terms like ""người làm điều ác"" for ""pāpakārī"" and ""nghiệp ác"" for ""pāpa"" seems appropriate. The structure should reflect the cause and effect, showing the person's lamentation both before and after committing evil, leading to a worse fate. I need to make sure the tenses and causal relationships are clear. Maybe using ""khóc than"" for ""tappati"" to convey the sense of lamentation. Also, ""đi đến nơi dữ"" for ""duggatiṃ gato"" to express going to a bad destination. Let me piece it all together now.
</think>

Ở đây khóc than, sau này khóc than, người làm điều ác khóc than cả hai cách; khóc than rằng ""Tôi đã tạo nghiệp ác"", người ấy càng khóc than nhiều hơn khi đã đi đến nơi dữ.",{}
18,"Idha nandati pecca nandati, katapuñño ubhayattha nandati; Puññaṃ me katanti nandati, bhiyyo nandati suggatiṃ gato.","Nay hoan đời sau hoan, Người thiện, hai đời hoan. Nó hoan: Ta làm thiện, Sanh cõi lành, hoan hơn.",Dhammapada 18 (Thích Minh Châu),"Ở đây, người ấy vui vì đã làm, sau khi chết cũng vui, vì đã làm phúc ở cả hai nơi; người ấy vui vì đã làm phúc, và vui hơn khi đã đi đến cõi thiện.","{
  ""accuracy"": 5,
   ""fluency"": 4,
   ""explanation"": ""The translation accurately preserves the meaning of the Pali text, but the wording could be more natural and fluent in Vietnamese.""
}","Ở đây vui mừng, ở kia cũng vui mừng; người đã làm công đức thì vui mừng ở cả hai nơi. Những người làm công đức vui mừng, và sau này còn vui mừng khi đã tới nơi an lạc.",{},"Ở đây người ta vui mừng, sau khi chết vẫn vui mừng; người đã làm phước vui mừng ở cả hai nơi. Người ấy vui mừng nghĩ: “Ta đã làm phước,” và còn vui mừng hơn khi được sinh lên cảnh giới tốt.",{},"<think>
Okay, let's tackle this Pali to Vietnamese translation. First, I need to understand the original text. The Pali sentence is:

""Idha nandati pecca nandati, katapuñño ubhayattha nandati; Puññaṃ me katanti nandati, bhiyyo nandati suggatiṃ gato.""

Breaking it down, ""Idha nandati"" means ""Here, he rejoices."" ""Pecca nandati"" would be ""in the future, he rejoices."" ""Katapuñño ubhayattha nandati"" – ""The one who has done merit rejoices in both."" Then the second part: ""Puññaṃ me katanti nandati"" – ""He rejoices that I have done merit,"" and ""bhiyyo nandati suggatiṃ gato"" – ""he rejoices more when going to a good destination.""

Now, translating into Vietnamese. Let's make sure the terms are correct. ""Nandati"" is ""vui mừng"" or ""hân hoan."" ""Katapuñño"" is ""người đã tạo phước."" ""Ubhayattha"" is ""cả hai"" or ""trong cả hai."" ""Puññaṃ me katanti"" is ""tôi đã tạo phước."" ""Bhiyyo nandati"" is ""vui mừng hơn"" and ""suggatiṃ gato"" is ""đi đến cõi tốt.""

Putting it all together in Vietnamese while maintaining the structure. Let's check each part again for accuracy. The first part talks about rejoicing in the present and future. The second part emphasizes the joy of having done merit and the greater joy of going to a good rebirth. Need to ensure the flow is natural in Vietnamese. Maybe use ""vui mừng"" consistently. Also, ""suggatiṃ gato"" could be ""đi đến cõi tốt"" or ""được sinh vào cõi tốt."" Let's go with the first for simplicity. Double-checking the translation for any possible errors. Looks good. Now, present the final translation without any extra commentary.
</think>

Ở đây vui mừng, về sau vui mừng, người đã tạo phước vui mừng trong cả hai; Vui mừng rằng tôi đã tạo phước, vui mừng hơn khi đi đến cõi tốt.",{}
