id,pali_text,ref_vietnamese,source,trans_Pali_Llama-3.3-70b,judge_Pali_Llama-3.3-70b,trans_Pali_GPT-OSS-120b,judge_Pali_GPT-OSS-120b,trans_Pali_Kimi-k2,judge_Pali_Kimi-k2,trans_Pali_Qwen3-32b,judge_Pali_Qwen3-32b
1,"Manopubbaṅgamā dhammā, manoseṭṭhā manomayā; Manasā ce paduṭṭhena, bhāsati vā karoti vā; Tato naṃ dukkhamanveti, cakkaṃva vahato padaṃ.","Ý dẫn đầu các pháp, Ý làm chủ, ý tạo; Nếu với ý ô nhiễm, Nói lên hay hành động, Khổ não bước theo sau, Như xe, chân vật kéo.",Dhammapada 1 (Thích Minh Châu),"Các pháp đều do tâm dẫn đầu, tâm là tối thượng, tâm tạo ra tất cả. Nếu tâm bị ô nhiễm, thì lời nói và hành động cũng sẽ như vậy; và từ đó, khổ sẽ theo đuổi, như bánh xe theo chân con bò.","{
  ""accuracy"": 4,
   ""fluency"": 4,
   ""explanation"": ""The translation generally preserves the meaning of the Pali text, with minor imperfections in wording and phrasing, and is readable with slight awkwardness in some expressions.""
}","Những pháp đều do tâm sinh ra, tâm là chủ của chúng; mọi pháp đều do tâm tạo nên. Khi tâm suy nghĩ xấu, nói hoặc làm việc, thì sẽ dẫn đến khổ đau, như bánh xe của xe chạy theo trục.","{
  ""accuracy"": 4,
   ""fluency"": 4,
   ""explanation"": ""The translation generally preserves the meaning of the Pali text, but uses slightly different wording and phrasing, such as 'những pháp đều do tâm sinh ra' instead of 'ý dẫn đầu các pháp', and 'bánh xe của xe chạy theo trục' instead of 'chân vật kéo', which are still understandable and natural in Vietnamese.""
}","Tất cả pháp đều do tâm dẫn đầu, do tâm là chủ, do tâm tạo thành. Nếu với tâm ô nhiễm, người ấy nói hay làm, thì khổ đau theo đuổi người ấy, như bánh xe theo bước chân con vật kéo xe.",{},"<think>
Okay, I need to translate this Pali text into Vietnamese. Let me start by reading through the original text carefully. The first line is ""Manopubbaṅgamā dhammā, manoseṭṭhā manomayā;"". I know that ""Mano"" in Pali refers to the mind or intention. ""Pubbaṅgamā"" might be a form of ""pubbaṅgama,"" which means leading or preceding. So ""Manopubbaṅgamā dhammā"" could translate to ""The Dhammas (teachings or phenomena) are led by the mind."" 

Next part: ""manoseṭṭhā manomayā;"". ""Setthā"" means best or chief, so ""manoseṭṭhā"" would be ""chief of the mind."" ""Manomayā"" is a compound of ""mano"" and ""maya,"" which can mean ""created by the mind"" or ""mind-made."" So maybe ""chief of the mind, mind-made.""

Moving on to the second line: ""Manasā ce paduṭṭhena, bhāsati vā karoti vā;"". ""Manasā"" is by the mind, ""ce"" is if, ""paduṭṭhena"" is corrupted or defiled. So ""If one speaks or acts with a corrupted mind."" 

Third line: ""Tato naṃ dukkhamanveti, cakkaṃva vahato padaṃ."" ""Tato"" from that, ""naṃ"" him/her, ""dukkhamanveti"" follows suffering, ""cakkaṃva"" like a chariot wheel, ""vahato padaṃ"" follows the one who drives. So maybe ""Suffering follows him like a chariot wheel follows the one who drives.""

Putting it all together in Vietnamese. Let me check each term again to make sure. ""Dhammā"" is ""pháp"" in Vietnamese. ""Pubbaṅgamā"" as ""đi đầu"" or ""lãnh đạo."" ""Manoseṭṭhā"" could be ""chủ chốt của tâm"" or ""chủ yếu của tâm."" ""Manomayā"" as ""tâm tạo"" or ""do tâm tạo ra."" 

For the second line: ""Nếu tâm bị ô nhiễm, người ấy nói hoặc làm..."" 

Third line: ""Từ đó, đau khổ theo đuổi người ấy, như bánh xe theo chân người cưỡi ngựa."" Wait, ""vahato padaṃ"" might be ""the driver's foot"" or ""the one who drives."" Maybe ""như bánh xe theo chân người cưỡi ngựa"" is a bit literal. Maybe ""như bánh xe theo chân người lái xe"" to make it clearer.

Let me verify the standard translation of this verse. I recall this is similar to the Dhammapada verse 1-2. The standard Vietnamese translation might be something like:

""Pháp do tâm sinh, tâm là chủ, tâm tạo. Nếu người dùng tâm ô nhiễm mà nói hay làm, thì đau khổ sẽ theo người ấy như bánh xe theo chân người cưỡi ngựa.""

But I need to make sure the terms match the original Pali. Let me adjust accordingly. Maybe ""Pháp do tâm sinh, tâm là chủ, tâm tạo."" Then ""Nếu người dùng tâm ô nhiễm mà nói hay làm, thì đau khổ sẽ theo người ấy như bánh xe theo chân người cưỡi ngựa.""

Yes, that seems accurate. I'll go with that.
</think>

Pháp do tâm sinh, tâm là chủ, tâm tạo. Nếu người dùng tâm ô nhiễm mà nói hay làm, thì đau khổ sẽ theo người ấy như bánh xe theo chân người cưỡi ngựa.",{}
2,"Manopubbaṅgamā dhammā, manoseṭṭhā manomayā; Manasā ce pasannena, bhāsati vā karoti vā; Tato naṃ sukhamanveti, chāyāva anapāyinī.","Ý dẫn đầu các pháp, Ý làm chủ, ý tạo; Nếu với ý thanh tịnh, Nói lên hay hành động, An lạc bước theo sau, Như bóng, không rời hình.",Dhammapada 2 (Thích Minh Châu),"Các pháp do tâm dẫn đầu, tâm là tối thượng, tâm tạo ra tất cả. Nếu tâm trong sạch, thì bất cứ điều gì người ta nói hay làm, hạnh phúc sẽ theo đuổi họ như bóng không bao giờ rời bỏ.","{
  ""accuracy"": 4,
   ""fluency"": 4,
   ""explanation"": ""The translation generally preserves the meaning of the Pali text, but uses slightly different wording and phrasing compared to the reference translation, and has minor imperfections in fluency.""
}","Tất cả hiện tượng tâm đều bắt nguồn từ tâm, do tâm dẫn dắt và được tạo nên từ tâm; nếu người nào nói lời hay hành động với tâm thanh thản, hạnh phúc sẽ theo người ấy như bóng dáng không rời.","{
  ""accuracy"": 5,
   ""fluency"": 5,
   ""explanation"": ""The candidate translation accurately preserves the meaning of the Pali text and conveys it in a natural, fluent Vietnamese expression.""
}","Tâm là nguồn gốc của mọi pháp, tâm là chủ, do tâm tạo; nếu với tâm thanh tịnh, người ấy nói hay làm; thì hạnh phúc theo đuổi người ấy, như bóng không rời.",{},"<think>
Okay, let's tackle this Pali to Vietnamese translation. First, I need to understand the original text. The Pali lines are from a Buddhist scripture, probably a verse about the mind's role in actions and their consequences. 

Starting with the first line: ""Manopubbaṅgamā dhammā, manoseṭṭhā manomayā;"". Breaking it down, ""Manopubbaṅgamā"" might mean ""originating from the mind"" or ""mind-led"". ""Dhammā"" is ""dhammas"" or ""phenomena"". The second part ""manoseṭṭhā manomayā"" could be ""mind-born, mind-made"". So the first line is saying that all dhammas originate from the mind, are mind-born, and mind-made.

Next line: ""Manasā ce pasannena, bhāsati vā karoti vā;"". ""Manasā"" is ""with the mind"", ""pasannena"" might be ""pure"" or ""cleansed"". ""Bhāsati"" is ""speaks"" and ""karoti"" is ""does"". So if one speaks or acts with a pure mind...

Third line: ""Tato naṃ sukhamanveti, chāyāva anapāyinī."" ""Tato"" is ""then"", ""naṃ"" is ""he/she"", ""sukhamanveti"" could be ""follows happiness"" or ""happiness follows"". ""Chāyāva anapāyinī"" is ""like a shadow that never leaves"".

Now, translating into Vietnamese. Need to keep the poetic structure. Let's see:

First line: ""Những pháp do tâm khởi đầu, tâm làm chủ, tâm tạo ra;"". ""Pháp"" is the term for dhamma. ""Khởi đầu"" for pubbaṅgamā, ""làm chủ"" for seṭṭhā, ""tạo ra"" for mayā.

Second line: ""Nếu với tâm thanh tịnh, nói lời hay hay làm việc thiện;"". ""Thanh tịnh"" for pasannena, ""nói lời hay"" for bhāsati, ""làm việc thiện"" for karoti.

Third line: ""Thì hạnh phúc sẽ theo gót, như bóng hình không rời xa."" ""Hạnh phúc sẽ theo gót"" for sukhamanveti, ""bóng hình không rời xa"" for chāyāva anapāyinī.

Check the flow and accuracy. Make sure the terms are correct in Buddhist context. ""Pháp"" is correct for dhamma. ""Tâm"" is mind. The structure is similar to the original, maintaining the three-line structure. The last line uses a simile of a shadow, which is common in Buddhist texts. 

Double-check the translation for any possible errors. ""Manomayā"" is ""mind-made"", so ""tâm tạo ra"" is accurate. ""Pasannena"" as ""thanh tịnh"" (pure/clean) fits. The verbs ""nói"" and ""làm"" are appropriate for ""bhāsati"" and ""karoti"". The final line's metaphor is clear and matches the original's intent. 

Looks good. The translation conveys the original meaning while maintaining the poetic form in Vietnamese.
</think>

Những pháp do tâm khởi đầu, tâm làm chủ, tâm tạo ra; Nếu với tâm thanh tịnh, nói lời hay hay làm việc thiện; Thì hạnh phúc sẽ theo gót, như bóng hình không rời xa.",{}
3,"Akkocchi maṃ avadhi maṃ, ajini maṃ ahāsi me; Ye ca taṃ upanayhanti, veraṃ tesaṃ na sammati.","Nó mắng tôi, đánh tôi, Nó thắng tôi, cướp tôi. Ai ôm hiềm hận ấy, Hận thù không thể nguôi.",Dhammapada 3 (Thích Minh Châu),"Không ai có thể làm cho tôi bị tổn thương, trừ khi tôi tự làm cho mình bị tổn thương; Những ai muốn gây tổn thương cho người khác, thì chính họ sẽ không được chấp nhận.","{
  ""accuracy"": 2,
   ""fluency"": 4,
   ""explanation"": ""The translation deviates from the original meaning, using 'tổn thương' (harm) instead of 'mắng' (scold), 'đánh' (hit), 'thắng' (win), and 'cướp' (rob), and changes the context of 'hiềm hận' (grudge) and 'hận thù' (hatred). However, the Vietnamese phrasing is natural and readable.""
}","Ai mắng tôi, đánh tôi, xúc phạm tôi; những người đưa hắn đến (tôi) không có hận thù.","{
  ""accuracy"": 3,
   ""fluency"": 4,
   ""explanation"": ""The translation generally preserves the meaning but has some noticeable errors, such as 'xúc phạm tôi' which doesn't fully capture the original meaning, and 'những người đưa hắn đến' which is not a natural Vietnamese way to express 'those who bring him to me'. However, the fluency is good, with a natural flow and understandable language.""
}","Người đã mắng ta, đánh ta, thắng ta, cướp ta; những ai ôm hận thù ấy, oán chẳng bao giờ dứt.",{},"<think>
Okay, let's tackle this Pali to Vietnamese translation. First, I need to understand the original text. The Pali verse is:

""Akkocchi maṃ avadhi maṃ, ajini maṃ ahāsi me; Ye ca taṃ upanayhanti, veraṃ tesaṃ na sammati.""

Breaking it down word by word:

- Akkocchi: This is a form of ""akkocati,"" which means ""to accuse"" or ""to blame."" The subject here is ""you"" (singular) in the past tense. So ""You accused me.""

- Maṃ avadhi maṃ: ""Avadhi"" is ""avadāna,"" which can mean ""to strike"" or ""to beat."" ""Maṃ"" is ""me."" So ""You struck me"" or ""You beat me.""

- Ajini maṃ ahāsi me: ""Ajini"" is ""ajānāti,"" meaning ""to not know."" ""Ahāsi"" is ""āhāsi,"" which is ""you said."" So ""You said you didn't know me.""

- Ye ca taṃ upanayhanti: ""Ye"" is ""those who,"" ""ca"" is ""and,"" ""taṃ"" is ""him,"" ""upanayhanti"" is ""lead to"" or ""bring near."" So ""Those who bring him near.""

- Veraṃ tesaṃ na sammati: ""Vera"" is ""hatred,"" ""tesaṃ"" is ""their,"" ""na sammati"" is ""does not agree"" or ""does not approve."" So ""He does not approve of their hatred.""

Putting it all together in English first:

""You accused me, you beat me, you said you didn't know me. Those who bring him near, he does not approve of their hatred.""

Now translating into Vietnamese:

- ""Akkocchi maṃ avadhi maṃ"" → ""Ngươi trách mắng ta, ngươi đánh ta""
- ""Ajini maṃ ahāsi me"" → ""Ngươi nói ngươi không biết ta""
- ""Ye ca taṃ upanayhanti"" → ""Những người đưa người ấy đến""
- ""Veraṃ tesaṃ na sammati"" → ""Người ấy không đồng ý với lòng ghét của họ""

Check for accuracy. Make sure the verbs and tenses match. In Vietnamese, the structure is Subject-Object-Verb, so adjust accordingly. Also, ensure that the terms like ""upanayhanti"" (to lead to) are correctly translated as ""đưa đến"" or ""dẫn đến."" Here, ""đưa người ấy đến"" seems appropriate.

Double-check the last line: ""Veraṃ tesaṃ na sammati."" ""Vera"" is hatred, ""tesaṃ"" refers to those who bring him near, so ""lòng ghét của họ."" ""Na sammati"" is ""does not approve,"" so ""người ấy không đồng ý.""

Final translation should be concise and match the original's meaning.
</think>

Ngươi trách mắng ta, ngươi đánh ta, ngươi nói ngươi không biết ta; Những người đưa người ấy đến, người ấy không đồng ý với lòng ghét của họ.",{}
4,"Akkocchi maṃ avadhi maṃ, ajini maṃ ahāsi me; Ye ca taṃ nūpanayhanti, veraṃ tesūpasammati.","Nó mắng tôi, đánh tôi, Nó thắng tôi, cướp tôi. Không ôm hiềm hận ấy, Hận thù được tự nguôi.",Dhammapada 4 (Thích Minh Châu),"Không ai có thể đánh bại tôi, tôi không đánh bại ai; Những ai gieo nhân duyên với tôi, thì sẽ gặt được kết quả tương ứng.","{
  ""accuracy"": 2,
   ""fluency"": 4,
   ""explanation"": ""The translation has major errors in preserving the original meaning, but the Vietnamese phrasing is quite natural and readable.""
}","Kẻ gọi tôi là kẻ ngu, kẻ nói “ngươi là kẻ ngu”, và những người lặp lại điều đó, đều đầy hận thù.","{
  ""accuracy"": 2,
   ""fluency"": 4,
   ""explanation"": ""The translation does not preserve the original meaning, as it changes the context from physical and verbal abuse to name-calling, but the Vietnamese phrasing is natural and readable.""
}","Người đã mắng ta, đánh ta, thắng ta, cướp của ta; Những ai không ôm hận thù ấy, oán liền lắng dịu.",{},"<think>
Okay, let's tackle this Pali to Vietnamese translation. First, I need to understand the original text. The Pali sentence is: ""Akkocchi maṃ avadhi maṃ, ajini maṃ ahāsi me; Ye ca taṃ nūpanayhanti, veraṃ tesūpasammati.""

Breaking it down, ""Akkocchi"" might be a form of ""akkocana"" which means to accuse or blame. ""Maṃ avadhi maṃ"" could be ""avadhi"" meaning to strike or harm. ""Ajini"" might be ""ajjhin"" which is a name or ""ajina"" meaning not born, but in context, maybe ""ajini"" is a name. ""Ahāsi me"" is ""you did not do to me."" The second part: ""Ye ca taṃ nūpanayhanti"" – ""ye ca"" is ""those who,"" ""taṃ"" is ""him,"" ""nūpanayhanti"" could be ""nūpana"" meaning new or fresh, so ""those who bring new things to him."" ""Veraṃ tesūpasammati"" – ""vera"" is hatred, ""tesu upasammati"" – ""upasammati"" is to pacify, so ""hatred is pacified among them.""

Putting it together: ""He who accuses me and harms me, you did not do so to me; those who bring new things to him, hatred is pacified among them.""

Now translating to Vietnamese. Need to make sure the structure is correct. The first part is two clauses. The second part is a relative clause. Let me check each word again.

""Akkocchi maṃ avadhi maṃ"" – ""Akkocchi"" (accuse) + ""avadhi"" (harm). So ""Người nào trách móc tôi và làm hại tôi."" Then ""ajini maṃ ahāsi me"" – ""Ajini"" might be a name, but if it's ""ajina"" (not born), maybe it's ""bạn không làm điều đó với tôi."" But ""ajini"" could be a name, so maybe ""Ajini không làm điều đó với tôi."" But since the original is in Pali, maybe the name is part of the text. Wait, maybe ""ajini"" is a typo for ""ajjhin"" which is a name. But the user provided the text as ""ajini,"" so I'll keep it as is. So the translation would be: ""Người nào trách móc tôi và làm hại tôi, Ajini không làm điều đó với tôi; Những ai mang điều mới đến cho người ấy, lòng oán hận sẽ được an tịnh trong họ.""

Wait, ""nūpanayhanti"" – ""nūpana"" is new, fresh. So ""mang điều mới đến cho người ấy."" And ""veraṃ tesūpasammati"" – ""lòng oán hận sẽ được an tịnh trong họ."" That seems right. Let me check the punctuation. The original uses commas and semicolons. In Vietnamese, maybe use commas and semicolons as well. So the final translation would be:

""Người nào trách móc tôi và làm hại tôi, Ajini không làm điều đó với tôi; Những ai mang điều mới đến cho người ấy, lòng oán hận sẽ được an tịnh trong họ.""

I think that's accurate. Let me double-check each part again to make sure there are no errors. Yes, that seems correct.
</think>

Người nào trách móc tôi và làm hại tôi, Ajini không làm điều đó với tôi; Những ai mang điều mới đến cho người ấy, lòng oán hận sẽ được an tịnh trong họ.",{}
5,"Na hi verena verāni, sammantīdha kudācanaṃ; Averena ca sammanti, esa dhammo sanantano.","Với hận diệt hận thù, Ðời này không có được. Không hận diệt hận thù, Là định luật ngàn thu.",Dhammapada 5 (Thích Minh Châu),"Không hận thù người hận thù, mà thân thiện với tất cả chúng sinh; Thân thiện với những người không thân thiện, đây là pháp thường hằng.","{
  ""accuracy"": 4,
   ""fluency"": 5,
   ""explanation"": ""The translation generally preserves the meaning of the original Pali text, but uses 'thân thiện' (friendly) instead of 'không hận' (no hatred) which is a minor imperfection. However, the Vietnamese translation is very fluent and natural.""
}",Không có hận thù nào có thể bị tiêu diệt bằng hận thù; cũng không có hận thù nào có thể được xua tan bằng hận thù; đây là pháp bất diệt.,"{
  ""accuracy"": 5,
   ""fluency"": 4,
   ""explanation"": ""The translation accurately preserves the meaning of the Pali text, but the phrasing could be more natural in Vietnamese.""
}","Không bao giờ có thể dứt hận bằng hận; chỉ có phi hận mới dứt được hận, đó là đạo lý thường hằng.",{},"<think>
Okay, let's tackle this Pali translation. First, I need to understand the original text. The Pali sentence is: ""Na hi verena verāni, sammantīdha kudācanaṃ; Averena ca sammanti, esa dhammo sanantano."" 

Breaking it down, ""Na hi verena verāni"" – ""verena"" is the instrumental of ""verāni,"" which means hatred. So ""by hatred, hatred is not appeased."" Then ""sammantīdha kudācanaṃ"" – ""sammantīdha"" might be a form of ""sammanti,"" to be appeased, and ""kudācanaṃ"" is ""anywhere."" So ""nor is there any place where hatred is appeased by hatred.""

Next line: ""Averena ca sammanti, esa dhammo sanantano."" ""Averena"" is the instrumental of ""averā,"" meaning without hatred. So ""by non-hatred, they are appeased; this is the eternal law."" 

Now, translating into Vietnamese. The key is to keep the meaning accurate and the structure poetic, as it's a verse. 

""Chẳng nhờ oán hận mà oán hận dứt, đâu có nơi nào oán hận dẹp yên; Dứt oán hận rồi mới yên, đạo lý này xưa nay vậy."" 

Wait, let me check each part again. ""Na hi verena verāni"" – ""Chẳng nhờ oán hận mà oán hận dứt."" That seems right. ""Sammantīdha kudācanaṃ"" – ""đâu có nơi nào oán hận dẹp yên."" Then ""Averena ca sammanti"" – ""Dứt oán hận rồi mới yên."" And ""esa dhammo sanantano"" – ""đạo lý này xưa nay vậy."" 

I think that's accurate. The structure in Vietnamese should mirror the original's contrast between hatred and non-hatred, and the eternal nature of the law. Need to make sure the terms are consistent and the rhythm flows naturally in Vietnamese.
</think>

Chẳng nhờ oán hận mà oán hận dứt, đâu có nơi nào oán hận dẹp yên; Dứt oán hận rồi mới yên, đạo lý này xưa nay vậy.",{}
6,"Pare ca na vijānanti, mayamettha yamāmase; Ye ca tattha vijānanti, tato sammanti medhagā.","Người khác không hiểu rằng, Chúng ta đây bị diệt. Ai hiểu được điều này, Tranh luận được lắng nguôi.",Dhammapada 6 (Thích Minh Châu),"Những người khác không biết, chúng tôi biết như vậy; Những người biết như vậy, từ đó họ được gọi là người trí.","{
  ""accuracy"": 2,
   ""fluency"": 4,
   ""explanation"": ""The candidate translation fails to preserve the original meaning, particularly the concept of 'diệt' (destruction) and 'tranh luận' (argumentation) being 'lắng nguôi' (calmed), instead introducing a new idea of being called 'người trí' (wise person). However, the Vietnamese phrasing is relatively natural and fluent.""
}","Những người khác không biết, chúng ta ở đây đang đi; những người biết ở đó, họ đi đúng con đường trung đạo.","{
  ""accuracy"": 2,
   ""fluency"": 4,
   ""explanation"": ""The translation does not preserve the original meaning, using 'đi' (going) instead of 'diệt' (perishing) and 'con đường trung đạo' (middle path) which is not present in the original text, but the sentence structure is natural and fluent in Vietnamese.""
}","Người khác không hiểu, chúng tôi ở đây đang kiêng cữ; Những ai hiểu điều đó, thì khỏi tranh cãi.",{},"<think>
Okay, let's tackle this Pali translation. First, I need to understand the original text. The Pali sentence is: ""Pare ca na vijānanti, mayamettha yamāmase; Ye ca tattha vijānanti, tato sammanti medhagā.""

Breaking it down word by word:

- ""Pare ca na vijānanti"" – ""Pare"" means ""others,"" ""ca"" is ""also,"" ""na"" is ""not,"" and ""vijānanti"" is ""know."" So this part translates to ""Others do not know.""
- ""Mayamettha yamāmase"" – ""Maya"" is ""we,"" ""mettha"" might be a form of ""metta"" (loving-kindness), but here it could be ""mettha"" as a locative? Wait, ""mettha yamāmase"" – maybe ""mettha"" is ""here"" or ""in this matter,"" and ""yamāmase"" could be a form of ""yamā"" (to be silent) + ""mase"" (maybe a suffix or conjugation). So perhaps ""we are silent here"" or ""we remain silent in this matter.""
- The second line: ""Ye ca tattha vijānanti"" – ""Those who know there"" or ""Those who know that.""
- ""Tato sammanti medhagā"" – ""Tato"" is ""from there,"" ""sammanti"" is ""become silent"" or ""cease,"" and ""medhagā"" is ""the wise ones."" So ""The wise ones become silent from there.""

Putting it all together, the first line is contrasting others who don't know versus us who remain silent. The second line says that those who know, the wise become silent. The theme seems to be about silence in the face of knowledge or understanding.

Now translating into Vietnamese. Let's start with the first part: ""Pare ca na vijānanti"" – ""Người khác không biết."" Then ""mayamettha yamāmase"" – ""chúng ta ở đây im lặng"" or ""chúng ta thinh lặng ở đây."" 

Second line: ""Những ai biết điều đó, người trí thức thinh lặng."" Or maybe ""Những người hiểu rõ, người khôn ngoan im lặng.""

Putting it all together, making sure the structure is parallel and the meaning is clear. Let me check again:

Original: Others do not know, we remain silent here; Those who know, the wise become silent.

So in Vietnamese: ""Người khác không biết, chúng ta thinh lặng ở đây; Những ai biết điều đó, người trí thức thinh lặng.""

Wait, ""tato"" in the second line might mean ""from there"" or ""therefore."" So maybe ""Từ đó, người khôn ngoan thinh lặng."" Hmm. Let me adjust.

Original second line: ""Ye ca tattha vijānanti, tato sammanti medhagā."" So ""Those who know that, from there, the wise become silent."" So maybe ""Những ai biết điều đó, người khôn ngoan thinh lặng.""

Yes, that works. Final check for accuracy and flow. The translation should capture the contrast between the ignorant and the wise, and the silence of the wise upon true understanding.
</think>

Người khác không biết, chúng ta thinh lặng ở đây; Những ai biết điều đó, người khôn ngoan thinh lặng.",{}
