id,pali_text,sanskrit_text,ref_viet_thichminhchau,ref_viet_modern,theme,source,trans_Pali_Llama-3.3-70b,judge_Pali_Llama-3.3-70b,trans_Pali_GPT-OSS-120b,judge_Pali_GPT-OSS-120b,trans_Pali_Kimi-k2,judge_Pali_Kimi-k2,trans_Pali_Qwen3-32b,judge_Pali_Qwen3-32b,trans_Pali_Gemini-3-Flash-Preview,judge_Pali_Gemini-3-Flash-Preview,trans_Sanskrit_Llama-3.3-70b,judge_Sanskrit_Llama-3.3-70b,trans_Sanskrit_GPT-OSS-120b,judge_Sanskrit_GPT-OSS-120b,trans_Sanskrit_Kimi-k2,judge_Sanskrit_Kimi-k2,trans_Sanskrit_Qwen3-32b,judge_Sanskrit_Qwen3-32b,trans_Sanskrit_Gemini-3-Flash-Preview,judge_Sanskrit_Gemini-3-Flash-Preview
11,"Asāre sāramatino, sāre cāsāradassino; Te sāraṃ nādhigacchanti, micchāsaṅkappagocarā.","Asāre sāramatayaḥ, sāre cāsārasaṃjñinaḥ; Te sāraṃ nādhigacchanti, mithyā saṃkalpagocarāḥ.","Không chân, tưởng chân thật, Chân thật, thấy không chân. Họ không đạt chân thật, Do tà tư, tà hạnh.","Cái giả thì cho là thật, cái thật lại cho là giả. Những người có tư duy sai lệch như vậy sẽ không bao giờ tìm thấy chân lý.",False Views,Dhammapada 11 / Udanavarga 29.3,"Những người không có giá trị, sống giữa những người có giá trị, nhưng không nhận ra giá trị của họ; những người đó không đạt được giá trị, vì họ đi trên con đường tư duy sai lầm.","{""accuracy"": 2, ""fluency"": 3, ""explanation"": ""Misinterprets 's\u0101ra' (essence/truth) as 'gi\u00e1 tr\u1ecb' (value/worth of people), changing the meaning from discerning truth to social status.""}","Những người bám vào cái tôi và những người thấy không có cái tôi đều không đạt được sự thật của bản ngã, họ bị chi phối bởi ý định sai lầm.","{""accuracy"": 3, ""fluency"": 4, ""explanation"": ""Translates 's\u0101ra' (essence/substance) as 'c\u00e1i t\u00f4i' (ego/self), which is a specific philosophical interpretation rather than a literal translation.""}","Kẻ thấy vô nghĩa là quý, quý mà lại thấy vô nghĩa; Họ không đạt được điều quý, vì sống theo tư tưởng sai lầm.","{""accuracy"": 4, ""fluency"": 4, ""explanation"": ""Translates 's\u0101ra' as 'qu\u00fd' (precious/essential), which is accurate, though 'ch\u00e2n th\u1eadt' is more traditional.""}","Những người không hiểu bản chất, không thấy rõ bản chất; Họ không nắm bắt được bản chất, do theo đuổi ý nghĩ sai lầm.","{""accuracy"": 4, ""fluency"": 4, ""explanation"": ""Captures the meaning of 's\u0101ra' (essence/substance) well.""}","Coi không thực là thực, xem thực là không thực; Họ không đạt được thực, do nuôi dưỡng tà tư duy.","{""accuracy"": 5, ""fluency"": 4, ""explanation"": ""Accurate, though 'nu\u00f4i d\u01b0\u1ee1ng t\u00e0 t\u01b0 duy' is slightly more prose-like than the reference's poetic style.""}","Trong những thứ không có giá trị, người ta lại cho là có giá trị. Trong những thứ có giá trị, người ta lại cho là không có giá trị. Những người như vậy không đạt được giá trị thực sự, vì họ bị che khuất bởi những tư tưởng sai lầm.","{""accuracy"": 5, ""fluency"": 5, ""explanation"": ""Excellent translation. Captures the essence of 's\u0101ra' (essence/value) and 'as\u0101ra' (non-essence) very clearly in natural Vietnamese.""}","Những người bám vào vô ngã, và những người bám vào ngã; họ không đạt được ngã, họ là những người khao khát sai lầm.","{""accuracy"": 2, ""fluency"": 3, ""explanation"": ""The candidate introduces 'ng\u00e3' (self) and 'v\u00f4 ng\u00e3' (non-self), which are not in the text. The text refers to 's\u0101ra' (essence/substance) and 'as\u0101ra' (insubstantial).""}","Người ngu tưởng phù phiếm là thật, tưởng thật là phù phiếm; Họ không đạt được điều gì quý giá, vì tư duy sai lầm.","{""accuracy"": 4, ""fluency"": 4, ""explanation"": ""Good use of 'ph\u00f9 phi\u1ebfm' for 'as\u0101ra' (unsubstantial/essence-less).""}","Những người coi bản chất là phi bản chất, phi bản chất là bản chất; họ không thể đạt được bản chất do tư tưởng sai lầm.","{""accuracy"": 4, ""fluency"": 4, ""explanation"": ""Accurate use of 'b\u1ea3n ch\u1ea5t' for 's\u0101ra', though 'tinh hoa' or 'c\u1ed1t l\u00f5i' is more common in Buddhist Vietnamese.""}","Coi cái không cốt lõi là cốt lõi, coi cái cốt lõi là không cốt lõi; họ không đạt đến cái cốt lõi, vì theo đuổi những tà tư duy.","{""accuracy"": 5, ""fluency"": 5, ""explanation"": ""Translates 's\u0101ra' as 'c\u1ed1t l\u00f5i' (essence/core), which is a very accurate philosophical rendering.""}"
12,"Sārañca sārato ñatvā, asārañca asārato; Te sāraṃ adhigacchanti, sammāsaṅkappagocarā.","Sāraṃ ca sārato jñātvā, asāraṃ ca asārataḥ; Te sāraṃ adhigacchanti, samyak saṃkalpagocarāḥ.","Chân thật, biết chân thật, Không chân, biết không chân. Họ đạt được chân thật, Do chánh tư, chánh hạnh.","Cái thật biết là thật, cái giả biết là giả. Những người có tư duy đúng đắn như vậy sẽ tìm thấy chân lý.",Right Views,Dhammapada 12 / Udanavarga 29.4,"Những người nhận ra giá trị từ những người có giá trị, và không có giá trị từ những người không có giá trị; những người đó đạt được giá trị, vì họ đi trên con đường tư duy đúng đắn.","{""accuracy"": 2, ""fluency"": 3, ""explanation"": ""Same error as Item 11; treats 's\u0101ra' as a quality of people rather than the essence of reality/truth.""}","Những người biết được cái tôi và không có cái tôi đạt được sự thật của bản ngã, được dẫn dắt bởi ý định chính xác.","{""accuracy"": 3, ""fluency"": 4, ""explanation"": ""Same as Item 11, uses 'c\u00e1i t\u00f4i' for 's\u0101ra'.""}","Biết rõ cái gì quý là quý, cái gì không quý là không quý; Họ đạt được điều quý, vì sống theo tư tưởng chánh.","{""accuracy"": 4, ""fluency"": 4, ""explanation"": ""Maintains consistency with item 11. 'T\u01b0 t\u01b0\u1edfng ch\u00e1nh' is a bit clipped for 'samm\u0101sa\u1e45kappa'.""}","Những người hiểu bản chất, thấy rõ bản chất; Họ nắm bắt được bản chất, do theo đuổi ý nghĩ đúng đắn.","{""accuracy"": 4, ""fluency"": 4, ""explanation"": ""Consistent with the previous item, accurate.""}","Biết thực là thực, biết không thực là không thực; Họ đạt được thực, nhờ nuôi dưỡng chánh tư duy.","{""accuracy"": 5, ""fluency"": 4, ""explanation"": ""Accurate translation of 's\u0101ra' (essence/truth) and 'samm\u0101sa\u1e45kappa'.""}","Biết rõ giá trị và không giá trị, nhận ra bản chất của chúng; những người như vậy đạt được giá trị thực sự, vì họ có những tư tưởng đúng đắn.","{""accuracy"": 5, ""fluency"": 5, ""explanation"": ""Consistent with Item 11, providing a clear and accurate contrast between essence and non-essence.""}","Biết ngã là ngã và vô ngã là vô ngã; họ đạt được ngã, họ là những người khao khát đúng đắn.","{""accuracy"": 2, ""fluency"": 3, ""explanation"": ""Same error as Item 11; it forces the 'self/non-self' terminology onto a text about 'essence/truth'.""}","Biết rõ thật là thật, phù phiếm là phù phiếm; Họ đạt được điều quý giá, vì tư duy chân chính.","{""accuracy"": 5, ""fluency"": 5, ""explanation"": ""Clear, concise, and accurate.""}",Những người hiểu đúng bản chất và phi bản chất; họ đạt được bản chất nhờ tư tưởng đúng đắn.,"{""accuracy"": 4, ""fluency"": 4, ""explanation"": ""Accurate and mirrors the structure of the Sanskrit verse well.""}","Biết cái cốt lõi là cốt lõi, biết cái không cốt lõi là không cốt lõi; họ đạt đến cái cốt lõi, vì theo đuổi những chánh tư duy.","{""accuracy"": 5, ""fluency"": 5, ""explanation"": ""Consistent with the previous verse, accurately reflecting 'samyak sa\u1e43kalpa' (right intention/thought).""}"
13,"Yathā agāraṃ ducchannaṃ, vuṭṭhī samativijjhati; Evaṃ abhāvitaṃ cittaṃ, rāgo samativijjhati.","Yathāgāraṃ ducchannaṃ, vṛṣṭiḥ samatividhyati; Evam abhāvitaṃ cittaṃ, rāgaḥ samatividhyati.","Như ngôi nhà vụng lợp, Mưa liền xâm nhập vào. Cũng vậy tâm không tu, Tham dục liền xâm nhập.","Như mái nhà lợp vụng về thì mưa sẽ dột vào. Cũng vậy, tâm không được tu dưỡng thì dục vọng sẽ dễ dàng xâm chiếm.",Mind (Leaky),Dhammapada 13 / Udanavarga 31.27,"Giống như một ngôi nhà bị hư hỏng, gió có thể thổi qua dễ dàng; cũng vậy, một tâm trí không được tu dưỡng, tham lam có thể xâm chiếm dễ dàng.","{""accuracy"": 3, ""fluency"": 4, ""explanation"": ""Translates 'vu\u1e6d\u1e6dh\u012b' (rain) as 'gi\u00f3' (wind). While the metaphor holds, it is technically inaccurate.""}","Như một ngôi nhà kém chất lượng sẽ sụp đổ, như vậy tâm không có gì cũng bị chi phối bởi dạ dày (đam mê).","{""accuracy"": 2, ""fluency"": 2, ""explanation"": ""Mistranslates 'r\u0101go' (lust/passion) as 'd\u1ea1 d\u00e0y' (stomach) and 'samativijjhati' (penetrates) as 's\u1ee5p \u0111\u1ed5' (collapse).""}","Như ngôi nhà mái dột, mưa xuyên thấm vào; Cũng vậy tâm không tu, tham dục xâm chiếm.","{""accuracy"": 5, ""fluency"": 5, ""explanation"": ""Very natural Vietnamese imagery for a poorly thatched house.""}","Giống như ngôi nhà không che chắn kỹ, gió lùa vào trong; Cũng vậy, tâm chưa được tu dưỡng, dục vọng tràn vào.","{""accuracy"": 3, ""fluency"": 4, ""explanation"": ""Changes 'rain' (vu\u1e6d\u1e6dh\u012b) to 'wind' (gi\u00f3), which alters the traditional imagery, though the metaphor remains similar.""}","Như ngôi nhà lợp không kỹ, mưa sẽ xâm nhập vào; Cũng vậy, tâm không tu tập, tham dục sẽ xâm nhập vào.","{""accuracy"": 5, ""fluency"": 4, ""explanation"": ""Accurate, though slightly more wordy than the reference; 'l\u1ee3p kh\u00f4ng k\u1ef9' is very clear.""}","Giống như một ngôi nhà không có mái che, mưa sẽ thấm vào khắp nơi. Cũng vậy, một tâm trí không được tu dưỡng sẽ bị tham lam thấm vào.","{""accuracy"": 4, ""fluency"": 4, ""explanation"": ""Accurate. 'Kh\u00f4ng c\u00f3 m\u00e1i che' is slightly different from 'duchanna\u1e43' (badly thatched), but the metaphor remains intact.""}","Như mưa rơi vào nhà hỏng, như vậy tâm không có thiện tính cũng bị dính say.","{""accuracy"": 4, ""fluency"": 4, ""explanation"": ""A good translation. 'D\u00ednh say' is a bit informal for 'r\u0101ga\u1e25' (lust/passion), but the meaning is preserved.""}","Như mái nhà dột, mưa xuyên thấu; Tâm không tu tập, tham dục xuyên thấu.","{""accuracy"": 5, ""fluency"": 5, ""explanation"": ""Captures the metaphor perfectly with natural Vietnamese phrasing.""}","Nhà che không kín, mưa thấm vào; tâm không được bảo vệ, dục vọng thấm vào.","{""accuracy"": 5, ""fluency"": 5, ""explanation"": ""Simple, elegant, and perfectly captures the metaphor of the poorly roofed house.""}","Như ngôi nhà lợp không kỹ, mưa sẽ xâm nhập vào; cũng vậy, tâm không tu tập, tham dục sẽ xâm nhập vào.","{""accuracy"": 5, ""fluency"": 5, ""explanation"": ""Simple and accurate translation of the house/rain analogy for the mind.""}"
14,"Yathā agāraṃ suchannaṃ, vuṭṭhī na samativijjhati; Evaṃ subhāvitaṃ cittaṃ, rāgo na samativijjhati.","Yathāgāraṃ succhannaṃ, vṛṣṭir na samatividhyati; Evaṃ subhāvitaṃ cittaṃ, rāgo na samatividhyati.","Như ngôi nhà khéo lợp, Mưa không xâm nhập vào. Cũng vậy tâm khéo tu, Tham dục không xâm nhập.","Như mái nhà được lợp kỹ càng thì mưa không thể lọt vào. Cũng vậy, tâm được tu dưỡng khéo léo thì dục vọng không thể xâm nhập.",Mind (Guarded),Dhammapada 14 / Udanavarga 31.28,"Giống như một ngôi nhà được xây dựng tốt, gió không thể thổi qua; cũng vậy, một tâm trí được tu dưỡng, tham lam không thể xâm chiếm.","{""accuracy"": 3, ""fluency"": 4, ""explanation"": ""Again, translates 'vu\u1e6d\u1e6dh\u012b' (rain) as 'gi\u00f3' (wind).""}","Như một ngôi nhà được xây dựng tốt không sụp đổ, như vậy một tâm hồn tốt lành không bị dạ dày (đam mê) chi phối.","{""accuracy"": 2, ""fluency"": 2, ""explanation"": ""Same errors as Item 13 regarding 'd\u1ea1 d\u00e0y' and 's\u1ee5p \u0111\u1ed5'.""}","Như ngôi nhà mái kín, mưa không xuyên thấm; Cũng vậy tâm đã tu, tham dục không xâm chiếm.","{""accuracy"": 5, ""fluency"": 5, ""explanation"": ""Accurate and clear; 'm\u00e1i k\u00edn' is a good choice for 'suchanna\u1e43'.""}","Giống như ngôi nhà che chắn kỹ, gió không lùa vào; Cũng vậy, tâm được tu dưỡng tốt, dục vọng không xâm nhập.","{""accuracy"": 3, ""fluency"": 4, ""explanation"": ""Again, changes 'rain' to 'wind'.""}","Như ngôi nhà lợp kỹ, mưa không xâm nhập được; Cũng vậy, tâm khéo tu tập, tham dục không xâm nhập được.","{""accuracy"": 5, ""fluency"": 4, ""explanation"": ""Accurate and clear, effectively using the house metaphor for the mind.""}","Giống như một ngôi nhà có mái che, mưa sẽ không thấm vào. Cũng vậy, một tâm trí được tu dưỡng sẽ không bị tham lam thấm vào.","{""accuracy"": 4, ""fluency"": 4, ""explanation"": ""Accurate and clear. Good parallel to Item 13.""}","Như mưa không thấm vào nhà chắc chắn, như vậy tâm tốt không bị dính say.","{""accuracy"": 4, ""fluency"": 4, ""explanation"": ""Accurate and clear. It captures the metaphor of the well-thatched house effectively.""}","Như mái nhà kín, mưa không xuyên thấu; Tâm đã tu tập, tham dục không xuyên thấu.","{""accuracy"": 5, ""fluency"": 5, ""explanation"": ""Consistent with the previous item; very clear.""}","Nhà che kín, mưa không thấm vào; tâm được bảo vệ tốt, dục vọng không thấm vào.","{""accuracy"": 5, ""fluency"": 5, ""explanation"": ""Perfectly captures the inverse of the previous verse.""}","Như ngôi nhà lợp khéo léo, mưa không thể xâm nhập; cũng vậy, tâm khéo tu tập, tham dục không thể xâm nhập.","{""accuracy"": 5, ""fluency"": 5, ""explanation"": ""Perfectly mirrors the previous verse with the positive 'succhanna\u1e43' (well-roofed).""}"
15,"Idha socati pecca socati, pāpakārī ubhayattha socati; So socati so vihaññati, disvā kammakiliṭṭhamattano.","Iha śocati pretya śocati, pāpakārī ubhayatra śocati; Sa śocati sa vihanyate, dṛṣṭvā karmakliṣṭam ātmanaḥ.","Nay sầu, đời sau sầu, Kẻ ác, hai đời sầu. Nó sầu, nó ưu não, Thấy nghiệp uế mình làm.","Đời này buồn khổ, đời sau cũng buồn khổ, kẻ làm ác chịu khổ cả hai nơi. Người ấy than khóc và ưu phiền khi nhìn thấy những hành động ô uế của chính mình.",Grief (Evil),Dhammapada 15 / Udanavarga 9.5,"Người làm ác sẽ than thở ở đây và sau khi chết, họ than thở ở cả hai nơi; họ than thở và đau khổ khi thấy hành động ác của mình.","{""accuracy"": 5, ""fluency"": 5, ""explanation"": ""Accurate and captures the repetitive structure of the Pali verse well.""}","Ở đây người buồn, sau này người buồn, kẻ làm ác buồn ở cả hai nơi; người buồn tự hủy hoại mình khi thấy hành động ác của mình.","{""accuracy"": 5, ""fluency"": 5, ""explanation"": ""Accurate and natural translation of the verse.""}","Ở đây khóc, chết rồi cũng khóc, kẻ làm ác khóc cả hai nơi; Hắn khóc, hắn đau khổ, khi thấy nghiệp ô uế của mình.","{""accuracy"": 4, ""fluency"": 4, ""explanation"": ""Translates 'socati' as 'kh\u00f3c' (crying), which is more specific than 's\u1ea7u' (sorrow), but conveys the distress.""}","Ở đời này, sau này, kẻ tạo ác nghiệp đều khổ; Kẻ ấy khổ, bị xé nát, nhìn thấy quả báo của chính mình.","{""accuracy"": 4, ""fluency"": 4, ""explanation"": ""Accurate. 'B\u1ecb x\u00e9 n\u00e1t' is a strong choice for 'viha\u00f1\u00f1ati' but acceptable.""}","Nay sầu, đời sau sầu, kẻ làm ác sầu cả hai nơi; Nó sầu, nó khổ não, khi thấy nghiệp uế nhiễm của mình.","{""accuracy"": 5, ""fluency"": 4, ""explanation"": ""Accurately translates 'ubhayattha' (both places/worlds) and the sorrow of the wrongdoer.""}","Người làm ác sẽ than thở ở đây và sẽ than thở sau khi chết, họ sẽ than thở ở cả hai nơi. Họ sẽ than thở và sẽ bị tổn thương khi nhìn thấy những hành động bất thiện của mình.","{""accuracy"": 5, ""fluency"": 4, ""explanation"": ""Accurate translation of the Sanskrit '\u015bocati' (grieves/sorrows) and the realization of one's own defiled actions.""}","Ở đây người buồn, sau khi chết người cũng buồn, kẻ ác làm hại ở cả hai nơi buồn; Kẻ buồn sẽ bị tiêu diệt, khi nhìn thấy tội lỗi nghiệp của mình.","{""accuracy"": 4, ""fluency"": 4, ""explanation"": ""Accurate translation of the dual suffering in this life and the next. 'Ti\u00eau di\u1ec7t' is a bit strong for 'vihanyate' (distressed/afflicted), but acceptable.""}","Ở đời khóc, chết rồi cũng khóc, kẻ làm ác khóc cả hai nơi; Họ khóc, họ đau đớn, khi thấy nghiệp uế của mình.","{""accuracy"": 4, ""fluency"": 4, ""explanation"": ""Translates '\u015bocati' (grieves) as 'kh\u00f3c' (cries), which is a bit narrow but acceptable.""}",Người làm ác khổ đau ở hiện tại và sau khi chết; người ấy đau khổ và bị tiêu diệt khi thấy quả báo của nghiệp xấu.,"{""accuracy"": 4, ""fluency"": 4, ""explanation"": ""Accurate. 'B\u1ecb ti\u00eau di\u1ec7t' is a bit strong for 'vihanyate' (suffers/is distressed), but acceptable.""}","Đời này sầu muộn, đời sau sầu muộn, kẻ làm ác sầu muộn cả hai nơi; người ấy sầu muộn, người ấy bị dày vò khi thấy nghiệp uế nhiễm của chính mình.","{""accuracy"": 5, ""fluency"": 5, ""explanation"": ""Accurately translates 'karmakli\u1e63\u1e6dam' as 'nghi\u1ec7p u\u1ebf nhi\u1ec5m' and the double sorrow.""}"
16,"Idha modati pecca modati, katapuñño ubhayattha modati; So modati so pamodati, disvā kammavisuddhimattano.","Iha modate pretya modate, kṛtapuṇyo ubhayatra modate; Sa modate sa pramodate, dṛṣṭvā karmaviśuddhim ātmanaḥ.","Nay vui, đời sau vui, Làm phước, hai đời vui. Nó vui, nó an vui, Thấy nghiệp tịnh mình làm.","Đời này vui, đời sau cũng vui, người làm phước hưởng vui cả hai nơi. Người ấy an vui và hân hoan khi nhìn thấy những hành động thanh tịnh của chính mình.",Joy (Good),Dhammapada 16 / Udanavarga 9.6,"Người làm善 sẽ vui mừng ở đây và sau khi chết, họ vui mừng ở cả hai nơi; họ vui mừng và hoan hỷ khi thấy hành động thiện của mình.","{""accuracy"": 4, ""fluency"": 4, ""explanation"": ""Accurate, though it contains a Chinese character '\u5584' instead of the Vietnamese word 'thi\u1ec7n'.""}","Ở đây người vui, sau này người vui, người đã làm công đức vui ở cả hai nơi; người vui tự hào khi thấy hành động trong sạch của mình.","{""accuracy"": 5, ""fluency"": 5, ""explanation"": ""Accurate and natural translation of the verse.""}","Ở đây vui, chết rồi cũng vui, người làm phước vui cả hai nơi; Người ấy vui, người ấy hoan hỷ, khi thấy nghiệp thanh tịnh của mình.","{""accuracy"": 5, ""fluency"": 5, ""explanation"": ""Accurately reflects the joy of the merit-maker in both worlds.""}","Ở đời này, sau này, kẻ tạo thiện nghiệp đều vui; Kẻ ấy vui, được hoan hỷ, nhìn thấy quả lành của chính mình.","{""accuracy"": 5, ""fluency"": 5, ""explanation"": ""Accurate and natural.""}","Nay vui, đời sau vui, người làm phước vui cả hai nơi; Nó vui, nó hân hoan, khi thấy nghiệp thanh tịnh của mình.","{""accuracy"": 5, ""fluency"": 4, ""explanation"": ""Accurate translation of 'modati' and 'kammavisuddhi' (purity of action).""}","Người làm điều thiện sẽ vui mừng ở đây và sẽ vui mừng sau khi chết, họ sẽ vui mừng ở cả hai nơi. Họ sẽ vui mừng và sẽ hoan hỷ khi nhìn thấy sự trong sạch của những hành động của mình.","{""accuracy"": 5, ""fluency"": 4, ""explanation"": ""Accurate translation of the joy resulting from pure actions.""}","Ở đây người vui, sau khi chết người cũng vui, người làm việc thiện ở cả hai nơi vui; Kẻ vui mừng, người ấy hạnh phúc, khi thấy sự trong sạch nghiệp của mình.","{""accuracy"": 5, ""fluency"": 5, ""explanation"": ""Very accurate and flows naturally in Vietnamese. Correctly identifies the joy resulting from pure actions.""}","Ở đời vui, chết rồi cũng vui, người có phước vui cả hai nơi; Họ vui, họ hoan hỷ, khi thấy nghiệp thanh tịnh của mình.","{""accuracy"": 5, ""fluency"": 5, ""explanation"": ""Accurate and flows well.""}",Người làm thiện vui sướng ở hiện tại và sau khi chết; người ấy vui vẻ và rất vui khi thấy sự thanh tịnh của nghiệp.,"{""accuracy"": 5, ""fluency"": 5, ""explanation"": ""Accurate and fluent translation of the joy following pure actions.""}","Đời này hoan hỷ, đời sau hoan hỷ, kẻ làm phước hoan hỷ cả hai nơi; người ấy hoan hỷ, người ấy hân hoan khi thấy nghiệp thanh tịnh của chính mình.","{""accuracy"": 5, ""fluency"": 5, ""explanation"": ""Accurately translates 'karmavi\u015buddhim' as 'nghi\u1ec7p thanh t\u1ecbnh' and the double joy.""}"
17,"Idha tappati pecca tappati, pāpakārī ubhayattha tappati; Pāpaṃ me katanti tappati, bhiyyo tappati duggatiṃ gato.",(Unique to Pali - No direct Udanavarga parallel),"Nay than, đời sau than, Kẻ ác, hai đời than. Nó than: ""Ta làm ác"", Ðọa cõi dữ, than hơn.","Đời này than van, đời sau cũng than van, kẻ làm ác chịu khổ cả hai nơi. Hắn than: ""Ta đã làm điều ác"", và càng khổ hơn khi bị đọa vào cõi dữ.",Remorse,Dhammapada 17 / No Parallel,"Người làm ác sẽ hối hận ở đây và sau khi chết, họ hối hận ở cả hai nơi; họ hối hận vì đã làm ác và hối hận hơn nữa khi rơi vào cõi恶 giới.","{""accuracy"": 5, ""fluency"": 5, ""explanation"": ""Accurate translation of 'tappati' as 'h\u1ed1i h\u1eadn' (remorse/suffering).""}","Ở đây người chịu khổ, sau này người chịu khổ, kẻ làm ác chịu khổ ở cả hai nơi; người làm ác chịu khổ, sau này chịu khổ hơn vì rơi vào con đường xấu.","{""accuracy"": 5, ""fluency"": 5, ""explanation"": ""Accurate and natural translation of the verse.""}","Ở đây hối hận, chết rồi cũng hối, kẻ làm ác hối cả hai nơi; ‘Ta đã làm điều ác’ nên hối, đọa vào đường dữ càng hối hơn.","{""accuracy"": 5, ""fluency"": 5, ""explanation"": ""Good translation of 'tappati' as 'h\u1ed1i h\u1eadn' (remorse/torment) in this context.""}","Ở đời này, sau này, kẻ tạo ác nghiệp đều đau khổ; Kẻ ấy đau khổ vì nghĩ: 'Ta đã tạo ác nghiệp', đau khổ hơn khi đi vào ác đạo.","{""accuracy"": 5, ""fluency"": 5, ""explanation"": ""Very accurate translation of the suffering of the evil-doer.""}","Nay hối hận, đời sau hối hận, kẻ làm ác hối hận cả hai nơi; Nó hối hận rằng 'Ác nghiệp đã được ta làm', càng hối hận hơn khi đọa vào ác đạo.","{""accuracy"": 5, ""fluency"": 4, ""explanation"": ""Accurately captures the remorse (tappati) and the increased suffering in the lower realms.""}",Không có bản dịch vì văn bản gốc không có sẵn,"{""accuracy"": 1, ""fluency"": 1, ""explanation"": ""The candidate failed to provide a translation.""}",,"{""accuracy"": 0, ""fluency"": 0, ""explanation"": ""Translation failed""}",,"{""accuracy"": 0, ""fluency"": 0, ""explanation"": ""Translation failed""}",Đây là độc nhất trong tiếng Pali - Không có song song trực tiếp với Udanavarga.,"{""accuracy"": 1, ""fluency"": 1, ""explanation"": ""The candidate failed to translate the text, instead providing a meta-commentary about the source.""}",(Không có văn bản tương ứng),"{""accuracy"": 5, ""fluency"": 5, ""explanation"": ""Correctly identifies that there is no corresponding Sanskrit text provided for this Pali-specific verse.""}"
